{"specification_id":"MWM-PPR-SPEC","run_id":"PPR-RUN-EXAMPLE-001","chapter_id":"CH-EXAMPLE","baseline":{"baseline_id":"PPR-BL-EXAMPLE-001","chapter_id":"CH-EXAMPLE","volume_id":"VOL-EXAMPLE","approved_version":"approved-v5","copyedited_version":"ce-v5","proof_version":"proof-v1","output_version":null,"file_ids":["approved.docx","proof.pdf"],"hashes_or_fixity":["sha256:approved","sha256:proof"],"approved_variations":["VAR-EXAMPLE"],"stage":"proof","captured_at":"2026-08-14T00:00:00Z","captured_by":"PPR reviewer"},"proof":{"proof_id":"proof-v1","format":"pdf","file_id":"proof.pdf","fixity":"sha256:proof","completeness_status":"complete"},"formats":[{"format":"pdf","status":"pass","evidence":["proof-check-1"],"specialist_owner":null}],"findings":[],"corrections":[],"fixity_events":[],"upstream_statuses":[],"ledger":{"ledger_id":"PPR-LEDGER-EXAMPLE-001","run_id":"PPR-RUN-EXAMPLE-001","baseline_id":"PPR-BL-EXAMPLE-001","open_finding_ids":[],"accepted_correction_ids":[],"rejected_correction_ids":[],"reproof_pending_ids":[],"resolved_finding_ids":[],"high_critical_count":0,"source_unavailable_count":0,"upstream_blocker_count":0,"release_recommendation":"ready","owner_groups":["production"],"created_at":"2026-08-14T00:00:00Z","supersedes":null},"decision":{"decision_id":"PPR-DEC-EXAMPLE-001","run_id":"PPR-RUN-EXAMPLE-001","baseline_id":"PPR-BL-EXAMPLE-001","proof_id":"proof-v1","recommendation":"ready","finding_ids":[],"correction_ids":[],"fixity_event_ids":[],"rationale":"Baseline and proof evidence are complete.","conditions":[],"signatory_role":"volume editor","signatory":null,"signed_at":null,"status":"recommendation_only","supersedes":null,"created_at":"2026-08-14T00:00:00Z"},"generated_at":"2026-08-14T00:00:00Z"}
